"No.","Time","Source","Destination","Protocol","Length","Info"
"1","0.000000","00:00:00_00:00:03","Broadcast","ARP","64","Who has 150.100.0.2? Tell 150.100.0.3 [ETHERNET FRAME CHECK SEQUENCE INCORRECT]"
"2","0.000000","00:00:00_00:00:02","00:00:00_00:00:03","ARP","64","150.100.0.2 is at 00:00:00:00:00:02 [ETHERNET FRAME CHECK SEQUENCE INCORRECT]"
"3","0.000026","150.100.12.3","150.100.0.2","TCP","64","49153  >  57300 [SYN] Seq=0 Win=65535 Len=0 [ETHERNET FRAME CHECK SEQUENCE INCORRECT]"
"4","0.000026","00:00:00_00:00:02","Broadcast","ARP","64","Who has 150.100.0.3? Tell 150.100.0.2 [ETHERNET FRAME CHECK SEQUENCE INCORRECT]"
"5","0.000037","150.100.15.2","150.100.0.2","TCP","64","49153  >  57300 [SYN] Seq=0 Win=65535 Len=0 [ETHERNET FRAME CHECK SEQUENCE INCORRECT]"
"6","0.000077","150.100.15.6","150.100.0.2","TCP","64","49153  >  57300 [SYN] Seq=0 Win=65535 Len=0 [ETHERNET FRAME CHECK SEQUENCE INCORRECT]"
"7","0.000089","00:00:00_00:00:03","00:00:00_00:00:02","ARP","64","150.100.0.3 is at 00:00:00:00:00:03 [ETHERNET FRAME CHECK SEQUENCE INCORRECT]"
"8","0.000089","150.100.0.2","150.100.12.3","TCP","64","57300  >  49153 [SYN, ACK] Seq=0 Ack=1 Win=65535 Len=0 [ETHERNET FRAME CHECK SEQUENCE INCORRECT]"
"9","0.000096","150.100.0.2","150.100.15.2","TCP","64","57300  >  49153 [SYN, ACK] Seq=0 Ack=1 Win=65535 Len=0 [ETHERNET FRAME CHECK SEQUENCE INCORRECT]"
"10","0.000116","150.100.12.5","150.100.0.2","TCP","64","49153  >  57300 [SYN] Seq=0 Win=65535 Len=0 [ETHERNET FRAME CHECK SEQUENCE INCORRECT]"
"11","0.000125","150.100.0.2","150.100.15.6","TCP","64","57300  >  49153 [SYN, ACK] Seq=0 Ack=1 Win=65535 Len=0 [ETHERNET FRAME CHECK SEQUENCE INCORRECT]"
"12","0.000138","150.100.0.2","150.100.12.5","TCP","64","57300  >  49153 [SYN, ACK] Seq=0 Ack=1 Win=65535 Len=0 [ETHERNET FRAME CHECK SEQUENCE INCORRECT]"
"13","0.000174","150.100.12.3","150.100.0.2","TCP","64","49153  >  57300 [ACK] Seq=1 Ack=1 Win=65535 Len=0 [ETHERNET FRAME CHECK SEQUENCE INCORRECT]"
"14","0.000205","150.100.12.3","150.100.0.2","TCP","158","49153  >  57300 [ACK] Seq=1 Ack=1 Win=65535 Len=100 [ETHERNET FRAME CHECK SEQUENCE INCORRECT]"
"15","0.000205","150.100.0.2","150.100.12.3","TCP","64","57300  >  49153 [ACK] Seq=1 Ack=101 Win=65535 Len=0 [ETHERNET FRAME CHECK SEQUENCE INCORRECT]"
"16","0.000211","150.100.0.2","150.100.12.3","TCP","158","57300  >  49153 [ACK] Seq=1 Ack=101 Win=65535 Len=100 [ETHERNET FRAME CHECK SEQUENCE INCORRECT]"
"17","0.000231","150.100.0.2","150.100.12.3","TCP","158","57300  >  49153 [ACK] Seq=101 Ack=101 Win=65535 Len=100 [ETHERNET FRAME CHECK SEQUENCE INCORRECT]"
"18","0.000305","150.100.15.4","150.100.0.2","TCP","64","49153  >  57300 [SYN] Seq=0 Win=65535 Len=0 [ETHERNET FRAME CHECK SEQUENCE INCORRECT]"
"19","0.000305","150.100.0.2","150.100.15.4","TCP","64","57300  >  49153 [SYN, ACK] Seq=0 Ack=1 Win=65535 Len=0 [ETHERNET FRAME CHECK SEQUENCE INCORRECT]"
"20","0.000330","150.100.15.5","150.100.0.2","TCP","64","49153  >  57300 [SYN] Seq=0 Win=65535 Len=0 [ETHERNET FRAME CHECK SEQUENCE INCORRECT]"
"21","0.000330","150.100.0.2","150.100.15.5","TCP","64","57300  >  49153 [SYN, ACK] Seq=0 Ack=1 Win=65535 Len=0 [ETHERNET FRAME CHECK SEQUENCE INCORRECT]"
"22","0.000355","150.100.12.4","150.100.0.2","TCP","64","49153  >  57300 [SYN] Seq=0 Win=65535 Len=0 [ETHERNET FRAME CHECK SEQUENCE INCORRECT]"
"23","0.000355","150.100.0.2","150.100.12.4","TCP","64","57300  >  49153 [SYN, ACK] Seq=0 Ack=1 Win=65535 Len=0 [ETHERNET FRAME CHECK SEQUENCE INCORRECT]"
"24","0.000385","150.100.12.7","150.100.0.2","TCP","64","49153  >  57300 [SYN] Seq=0 Win=65535 Len=0 [ETHERNET FRAME CHECK SEQUENCE INCORRECT]"
"25","0.000385","150.100.0.2","150.100.12.7","TCP","64","57300  >  49153 [SYN, ACK] Seq=0 Ack=1 Win=65535 Len=0 [ETHERNET FRAME CHECK SEQUENCE INCORRECT]"
"26","0.000434","150.100.12.130","150.100.0.2","TCP","64","49153  >  57300 [SYN] Seq=0 Win=65535 Len=0 [ETHERNET FRAME CHECK SEQUENCE INCORRECT]"
"27","0.000434","150.100.0.2","150.100.12.130","TCP","64","57300  >  49153 [SYN, ACK] Seq=0 Ack=1 Win=65535 Len=0 [ETHERNET FRAME CHECK SEQUENCE INCORRECT]"
"28","0.000461","150.100.15.8","150.100.0.2","TCP","64","49153  >  57300 [SYN] Seq=0 Win=65535 Len=0 [ETHERNET FRAME CHECK SEQUENCE INCORRECT]"
"29","0.000461","150.100.0.2","150.100.15.8","TCP","64","57300  >  49153 [SYN, ACK] Seq=0 Ack=1 Win=65535 Len=0 [ETHERNET FRAME CHECK SEQUENCE INCORRECT]"
"30","0.000489","150.100.12.131","150.100.0.2","TCP","64","49153  >  57300 [SYN] Seq=0 Win=65535 Len=0 [ETHERNET FRAME CHECK SEQUENCE INCORRECT]"
"31","0.000489","150.100.0.2","150.100.12.131","TCP","64","57300  >  49153 [SYN, ACK] Seq=0 Ack=1 Win=65535 Len=0 [ETHERNET FRAME CHECK SEQUENCE INCORRECT]"
"32","0.000514","150.100.12.3","150.100.0.2","TCP","64","49153  >  57300 [ACK] Seq=101 Ack=101 Win=65535 Len=0 [ETHERNET FRAME CHECK SEQUENCE INCORRECT]"
"33","0.000564","150.100.12.137","150.100.0.2","TCP","64","49153  >  57300 [SYN] Seq=0 Win=65535 Len=0 [ETHERNET FRAME CHECK SEQUENCE INCORRECT]"
"34","0.000564","150.100.0.2","150.100.12.137","TCP","64","57300  >  49153 [SYN, ACK] Seq=0 Ack=1 Win=65535 Len=0 [ETHERNET FRAME CHECK SEQUENCE INCORRECT]"
"35","0.000597","150.100.12.5","150.100.0.2","TCP","64","49153  >  57300 [ACK] Seq=1 Ack=1 Win=65535 Len=0 [ETHERNET FRAME CHECK SEQUENCE INCORRECT]"
"36","0.000628","150.100.12.138","150.100.0.2","TCP","64","49153  >  57300 [SYN] Seq=0 Win=65535 Len=0 [ETHERNET FRAME CHECK SEQUENCE INCORRECT]"
"37","0.000628","150.100.0.2","150.100.12.138","TCP","64","57300  >  49153 [SYN, ACK] Seq=0 Ack=1 Win=65535 Len=0 [ETHERNET FRAME CHECK SEQUENCE INCORRECT]"
"38","0.000652","150.100.12.132","150.100.0.2","TCP","64","49153  >  57300 [SYN] Seq=0 Win=65535 Len=0 [ETHERNET FRAME CHECK SEQUENCE INCORRECT]"
"39","0.000652","150.100.0.2","150.100.12.132","TCP","64","57300  >  49153 [SYN, ACK] Seq=0 Ack=1 Win=65535 Len=0 [ETHERNET FRAME CHECK SEQUENCE INCORRECT]"
"40","0.000676","150.100.12.134","150.100.0.2","TCP","64","49153  >  57300 [SYN] Seq=0 Win=65535 Len=0 [ETHERNET FRAME CHECK SEQUENCE INCORRECT]"
"41","0.000676","150.100.0.2","150.100.12.134","TCP","64","57300  >  49153 [SYN, ACK] Seq=0 Ack=1 Win=65535 Len=0 [ETHERNET FRAME CHECK SEQUENCE INCORRECT]"
"42","0.000709","150.100.12.10","150.100.0.2","TCP","64","49153  >  57300 [SYN] Seq=0 Win=65535 Len=0 [ETHERNET FRAME CHECK SEQUENCE INCORRECT]"
"43","0.000709","150.100.0.2","150.100.12.10","TCP","64","57300  >  49153 [SYN, ACK] Seq=0 Ack=1 Win=65535 Len=0 [ETHERNET FRAME CHECK SEQUENCE INCORRECT]"
"44","0.000759","150.100.15.11","150.100.0.2","TCP","64","49153  >  57300 [SYN] Seq=0 Win=65535 Len=0 [ETHERNET FRAME CHECK SEQUENCE INCORRECT]"
"45","0.000759","150.100.0.2","150.100.15.11","TCP","64","57300  >  49153 [SYN, ACK] Seq=0 Ack=1 Win=65535 Len=0 [ETHERNET FRAME CHECK SEQUENCE INCORRECT]"
"46","0.000788","150.100.12.136","150.100.0.2","TCP","64","49153  >  57300 [SYN] Seq=0 Win=65535 Len=0 [ETHERNET FRAME CHECK SEQUENCE INCORRECT]"
"47","0.000788","150.100.0.2","150.100.12.136","TCP","64","57300  >  49153 [SYN, ACK] Seq=0 Ack=1 Win=65535 Len=0 [ETHERNET FRAME CHECK SEQUENCE INCORRECT]"
"48","0.000820","150.100.15.3","150.100.0.2","TCP","64","49153  >  57300 [SYN] Seq=0 Win=65535 Len=0 [ETHERNET FRAME CHECK SEQUENCE INCORRECT]"
"49","0.000820","150.100.0.2","150.100.15.3","TCP","64","57300  >  49153 [SYN, ACK] Seq=0 Ack=1 Win=65535 Len=0 [ETHERNET FRAME CHECK SEQUENCE INCORRECT]"
"50","0.000847","150.100.15.7","150.100.0.2","TCP","64","49153  >  57300 [SYN] Seq=0 Win=65535 Len=0 [ETHERNET FRAME CHECK SEQUENCE INCORRECT]"
"51","0.000847","150.100.0.2","150.100.15.7","TCP","64","57300  >  49153 [SYN, ACK] Seq=0 Ack=1 Win=65535 Len=0 [ETHERNET FRAME CHECK SEQUENCE INCORRECT]"
"52","0.000874","150.100.15.9","150.100.0.2","TCP","64","49153  >  57300 [SYN] Seq=0 Win=65535 Len=0 [ETHERNET FRAME CHECK SEQUENCE INCORRECT]"
"53","0.000874","150.100.0.2","150.100.15.9","TCP","64","57300  >  49153 [SYN, ACK] Seq=0 Ack=1 Win=65535 Len=0 [ETHERNET FRAME CHECK SEQUENCE INCORRECT]"
"54","0.000914","150.100.12.5","150.100.0.2","TCP","158","49153  >  57300 [ACK] Seq=1 Ack=1 Win=65535 Len=100 [ETHERNET FRAME CHECK SEQUENCE INCORRECT]"
"55","0.000914","150.100.0.2","150.100.12.5","TCP","64","57300  >  49153 [ACK] Seq=1 Ack=101 Win=65535 Len=0 [ETHERNET FRAME CHECK SEQUENCE INCORRECT]"
"56","0.000920","150.100.0.2","150.100.12.5","TCP","158","57300  >  49153 [ACK] Seq=1 Ack=101 Win=65535 Len=100 [ETHERNET FRAME CHECK SEQUENCE INCORRECT]"
"57","0.000942","150.100.0.2","150.100.12.5","TCP","158","57300  >  49153 [ACK] Seq=101 Ack=101 Win=65535 Len=100 [ETHERNET FRAME CHECK SEQUENCE INCORRECT]"
"58","0.001075","150.100.12.9","150.100.0.2","TCP","64","49153  >  57300 [SYN] Seq=0 Win=65535 Len=0 [ETHERNET FRAME CHECK SEQUENCE INCORRECT]"
"59","0.001075","150.100.0.2","150.100.12.9","TCP","64","57300  >  49153 [SYN, ACK] Seq=0 Ack=1 Win=65535 Len=0 [ETHERNET FRAME CHECK SEQUENCE INCORRECT]"
"60","0.001112","150.100.12.133","150.100.0.2","TCP","64","49153  >  57300 [SYN] Seq=0 Win=65535 Len=0 [ETHERNET FRAME CHECK SEQUENCE INCORRECT]"
"61","0.001112","150.100.0.2","150.100.12.133","TCP","64","57300  >  49153 [SYN, ACK] Seq=0 Ack=1 Win=65535 Len=0 [ETHERNET FRAME CHECK SEQUENCE INCORRECT]"
"62","0.001155","150.100.12.139","150.100.0.2","TCP","64","49153  >  57300 [SYN] Seq=0 Win=65535 Len=0 [ETHERNET FRAME CHECK SEQUENCE INCORRECT]"
"63","0.001155","150.100.0.2","150.100.12.139","TCP","64","57300  >  49153 [SYN, ACK] Seq=0 Ack=1 Win=65535 Len=0 [ETHERNET FRAME CHECK SEQUENCE INCORRECT]"
"64","0.001201","150.100.12.7","150.100.0.2","TCP","64","49153  >  57300 [ACK] Seq=1 Ack=1 Win=65535 Len=0 [ETHERNET FRAME CHECK SEQUENCE INCORRECT]"
"65","0.001233","150.100.12.7","150.100.0.2","TCP","158","49153  >  57300 [ACK] Seq=1 Ack=1 Win=65535 Len=100 [ETHERNET FRAME CHECK SEQUENCE INCORRECT]"
"66","0.001233","150.100.0.2","150.100.12.7","TCP","64","57300  >  49153 [ACK] Seq=1 Ack=101 Win=65535 Len=0 [ETHERNET FRAME CHECK SEQUENCE INCORRECT]"
"67","0.001239","150.100.0.2","150.100.12.7","TCP","158","57300  >  49153 [ACK] Seq=1 Ack=101 Win=65535 Len=100 [ETHERNET FRAME CHECK SEQUENCE INCORRECT]"
"68","0.001268","150.100.15.10","150.100.0.2","TCP","64","49153  >  57300 [SYN] Seq=0 Win=65535 Len=0 [ETHERNET FRAME CHECK SEQUENCE INCORRECT]"
"69","0.001282","150.100.12.135","150.100.0.2","TCP","64","49153  >  57300 [SYN] Seq=0 Win=65535 Len=0 [ETHERNET FRAME CHECK SEQUENCE INCORRECT]"
"70","0.001296","150.100.15.6","150.100.0.2","TCP","64","49153  >  57300 [ACK] Seq=1 Ack=1 Win=65535 Len=0 [ETHERNET FRAME CHECK SEQUENCE INCORRECT]"
"71","0.001316","150.100.15.6","150.100.0.2","TCP","158","49153  >  57300 [ACK] Seq=1 Ack=1 Win=65535 Len=100 [ETHERNET FRAME CHECK SEQUENCE INCORRECT]"
"72","0.001329","150.100.15.4","150.100.0.2","TCP","64","49153  >  57300 [ACK] Seq=1 Ack=1 Win=65535 Len=0 [ETHERNET FRAME CHECK SEQUENCE INCORRECT]"
"73","0.001345","150.100.12.130","150.100.0.2","TCP","64","49153  >  57300 [ACK] Seq=1 Ack=1 Win=65535 Len=0 [ETHERNET FRAME CHECK SEQUENCE INCORRECT]"
"74","0.001366","150.100.15.4","150.100.0.2","TCP","158","49153  >  57300 [ACK] Seq=1 Ack=1 Win=65535 Len=100 [ETHERNET FRAME CHECK SEQUENCE INCORRECT]"
"75","0.001385","150.100.12.130","150.100.0.2","TCP","158","49153  >  57300 [ACK] Seq=1 Ack=1 Win=65535 Len=100 [ETHERNET FRAME CHECK SEQUENCE INCORRECT]"
"76","0.001401","150.100.15.5","150.100.0.2","TCP","64","49153  >  57300 [ACK] Seq=1 Ack=1 Win=65535 Len=0 [ETHERNET FRAME CHECK SEQUENCE INCORRECT]"
"77","0.001415","150.100.12.131","150.100.0.2","TCP","64","49153  >  57300 [ACK] Seq=1 Ack=1 Win=65535 Len=0 [ETHERNET FRAME CHECK SEQUENCE INCORRECT]"
"78","0.001435","150.100.12.131","150.100.0.2","TCP","158","49153  >  57300 [ACK] Seq=1 Ack=1 Win=65535 Len=100 [ETHERNET FRAME CHECK SEQUENCE INCORRECT]"
"79","0.001480","150.100.15.5","150.100.0.2","TCP","158","49153  >  57300 [ACK] Seq=1 Ack=1 Win=65535 Len=100 [ETHERNET FRAME CHECK SEQUENCE INCORRECT]"
"80","0.001499","150.100.15.2","150.100.0.2","TCP","64","49153  >  57300 [ACK] Seq=1 Ack=1 Win=65535 Len=0 [ETHERNET FRAME CHECK SEQUENCE INCORRECT]"
"81","0.001513","150.100.12.137","150.100.0.2","TCP","64","49153  >  57300 [ACK] Seq=1 Ack=1 Win=65535 Len=0 [ETHERNET FRAME CHECK SEQUENCE INCORRECT]"
"82","0.001541","150.100.15.2","150.100.0.2","TCP","158","49153  >  57300 [ACK] Seq=1 Ack=1 Win=65535 Len=100 [ETHERNET FRAME CHECK SEQUENCE INCORRECT]"
"83","0.001564","150.100.0.2","150.100.12.7","TCP","158","57300  >  49153 [ACK] Seq=101 Ack=101 Win=65535 Len=100 [ETHERNET FRAME CHECK SEQUENCE INCORRECT]"
"84","0.001583","150.100.0.2","150.100.15.10","TCP","64","57300  >  49153 [SYN, ACK] Seq=0 Ack=1 Win=65535 Len=0 [ETHERNET FRAME CHECK SEQUENCE INCORRECT]"
"85","0.001596","150.100.0.2","150.100.12.135","TCP","64","57300  >  49153 [SYN, ACK] Seq=0 Ack=1 Win=65535 Len=0 [ETHERNET FRAME CHECK SEQUENCE INCORRECT]"
"86","0.001612","150.100.0.2","150.100.15.6","TCP","64","57300  >  49153 [ACK] Seq=1 Ack=101 Win=65535 Len=0 [ETHERNET FRAME CHECK SEQUENCE INCORRECT]"
"87","0.001626","150.100.0.2","150.100.15.6","TCP","158","57300  >  49153 [ACK] Seq=1 Ack=101 Win=65535 Len=100 [ETHERNET FRAME CHECK SEQUENCE INCORRECT]"
"88","0.001653","150.100.12.137","150.100.0.2","TCP","158","49153  >  57300 [ACK] Seq=1 Ack=1 Win=65535 Len=100 [ETHERNET FRAME CHECK SEQUENCE INCORRECT]"
"89","0.001668","150.100.15.8","150.100.0.2","TCP","64","49153  >  57300 [ACK] Seq=1 Ack=1 Win=65535 Len=0 [ETHERNET FRAME CHECK SEQUENCE INCORRECT]"
"90","0.001699","150.100.15.8","150.100.0.2","TCP","158","49153  >  57300 [ACK] Seq=1 Ack=1 Win=65535 Len=100 [ETHERNET FRAME CHECK SEQUENCE INCORRECT]"
"91","0.001720","150.100.12.138","150.100.0.2","TCP","64","49153  >  57300 [ACK] Seq=1 Ack=1 Win=65535 Len=0 [ETHERNET FRAME CHECK SEQUENCE INCORRECT]"
"92","0.001746","150.100.12.138","150.100.0.2","TCP","158","49153  >  57300 [ACK] Seq=1 Ack=1 Win=65535 Len=100 [ETHERNET FRAME CHECK SEQUENCE INCORRECT]"
"93","0.001758","150.100.12.132","150.100.0.2","TCP","64","49153  >  57300 [ACK] Seq=1 Ack=1 Win=65535 Len=0 [ETHERNET FRAME CHECK SEQUENCE INCORRECT]"
"94","0.001775","150.100.12.134","150.100.0.2","TCP","64","49153  >  57300 [ACK] Seq=1 Ack=1 Win=65535 Len=0 [ETHERNET FRAME CHECK SEQUENCE INCORRECT]"
"95","0.001794","150.100.12.134","150.100.0.2","TCP","158","49153  >  57300 [ACK] Seq=1 Ack=1 Win=65535 Len=100 [ETHERNET FRAME CHECK SEQUENCE INCORRECT]"
"96","0.001810","150.100.0.2","150.100.15.6","TCP","158","57300  >  49153 [ACK] Seq=101 Ack=101 Win=65535 Len=100 [ETHERNET FRAME CHECK SEQUENCE INCORRECT]"
"97","0.001830","150.100.0.2","150.100.15.4","TCP","64","57300  >  49153 [ACK] Seq=1 Ack=101 Win=65535 Len=0 [ETHERNET FRAME CHECK SEQUENCE INCORRECT]"
"98","0.001843","150.100.0.2","150.100.15.4","TCP","158","57300  >  49153 [ACK] Seq=1 Ack=101 Win=65535 Len=100 [ETHERNET FRAME CHECK SEQUENCE INCORRECT]"
"99","0.001864","150.100.0.2","150.100.15.4","TCP","158","57300  >  49153 [ACK] Seq=101 Ack=101 Win=65535 Len=100 [ETHERNET FRAME CHECK SEQUENCE INCORRECT]"
"100","0.001895","150.100.0.2","150.100.12.130","TCP","64","57300  >  49153 [ACK] Seq=1 Ack=101 Win=65535 Len=0 [ETHERNET FRAME CHECK SEQUENCE INCORRECT]"
"101","0.001915","150.100.12.8","150.100.0.2","TCP","64","49153  >  57300 [SYN] Seq=0 Win=65535 Len=0 [ETHERNET FRAME CHECK SEQUENCE INCORRECT]"
"102","0.001945","150.100.12.132","150.100.0.2","TCP","158","49153  >  57300 [ACK] Seq=1 Ack=1 Win=65535 Len=100 [ETHERNET FRAME CHECK SEQUENCE INCORRECT]"
"103","0.001957","150.100.15.11","150.100.0.2","TCP","64","49153  >  57300 [ACK] Seq=1 Ack=1 Win=65535 Len=0 [ETHERNET FRAME CHECK SEQUENCE INCORRECT]"
"104","0.001984","150.100.15.11","150.100.0.2","TCP","158","49153  >  57300 [ACK] Seq=1 Ack=1 Win=65535 Len=100 [ETHERNET FRAME CHECK SEQUENCE INCORRECT]"
"105","0.001997","150.100.12.136","150.100.0.2","TCP","64","49153  >  57300 [ACK] Seq=1 Ack=1 Win=65535 Len=0 [ETHERNET FRAME CHECK SEQUENCE INCORRECT]"
"106","0.002023","150.100.12.136","150.100.0.2","TCP","158","49153  >  57300 [ACK] Seq=1 Ack=1 Win=65535 Len=100 [ETHERNET FRAME CHECK SEQUENCE INCORRECT]"
"107","0.002038","150.100.12.133","150.100.0.2","TCP","64","49153  >  57300 [ACK] Seq=1 Ack=1 Win=65535 Len=0 [ETHERNET FRAME CHECK SEQUENCE INCORRECT]"
"108","0.002059","150.100.12.133","150.100.0.2","TCP","158","49153  >  57300 [ACK] Seq=1 Ack=1 Win=65535 Len=100 [ETHERNET FRAME CHECK SEQUENCE INCORRECT]"
"109","0.002081","150.100.12.139","150.100.0.2","TCP","64","49153  >  57300 [ACK] Seq=1 Ack=1 Win=65535 Len=0 [ETHERNET FRAME CHECK SEQUENCE INCORRECT]"
"110","0.002095","150.100.12.5","150.100.0.2","TCP","64","49153  >  57300 [ACK] Seq=101 Ack=101 Win=65535 Len=0 [ETHERNET FRAME CHECK SEQUENCE INCORRECT]"
"111","0.002101","150.100.0.2","150.100.12.130","TCP","158","57300  >  49153 [ACK] Seq=1 Ack=101 Win=65535 Len=100 [ETHERNET FRAME CHECK SEQUENCE INCORRECT]"
"112","0.002127","150.100.12.139","150.100.0.2","TCP","158","49153  >  57300 [ACK] Seq=1 Ack=1 Win=65535 Len=100 [ETHERNET FRAME CHECK SEQUENCE INCORRECT]"
"113","0.002139","150.100.12.6","150.100.0.2","TCP","64","49153  >  57300 [SYN] Seq=0 Win=65535 Len=0 [ETHERNET FRAME CHECK SEQUENCE INCORRECT]"
"114","0.002155","150.100.12.10","150.100.0.2","TCP","64","49153  >  57300 [ACK] Seq=1 Ack=1 Win=65535 Len=0 [ETHERNET FRAME CHECK SEQUENCE INCORRECT]"
"115","0.002176","150.100.12.10","150.100.0.2","TCP","158","49153  >  57300 [ACK] Seq=1 Ack=1 Win=65535 Len=100 [ETHERNET FRAME CHECK SEQUENCE INCORRECT]"
"116","0.002198","150.100.12.135","150.100.0.2","TCP","64","49153  >  57300 [ACK] Seq=1 Ack=1 Win=65535 Len=0 [ETHERNET FRAME CHECK SEQUENCE INCORRECT]"
"117","0.002213","150.100.0.2","150.100.12.130","TCP","158","57300  >  49153 [ACK] Seq=101 Ack=101 Win=65535 Len=100 [ETHERNET FRAME CHECK SEQUENCE INCORRECT]"
"118","0.002232","150.100.0.2","150.100.12.131","TCP","64","57300  >  49153 [ACK] Seq=1 Ack=101 Win=65535 Len=0 [ETHERNET FRAME CHECK SEQUENCE INCORRECT]"
"119","0.002244","150.100.0.2","150.100.12.131","TCP","158","57300  >  49153 [ACK] Seq=1 Ack=101 Win=65535 Len=100 [ETHERNET FRAME CHECK SEQUENCE INCORRECT]"
"120","0.002269","150.100.0.2","150.100.12.131","TCP","158","57300  >  49153 [ACK] Seq=101 Ack=101 Win=65535 Len=100 [ETHERNET FRAME CHECK SEQUENCE INCORRECT]"
"121","0.002298","150.100.12.135","150.100.0.2","TCP","158","49153  >  57300 [ACK] Seq=1 Ack=1 Win=65535 Len=100 [ETHERNET FRAME CHECK SEQUENCE INCORRECT]"
"122","0.002311","150.100.12.12","150.100.0.2","TCP","64","49153  >  57300 [SYN] Seq=0 Win=65535 Len=0 [ETHERNET FRAME CHECK SEQUENCE INCORRECT]"
"123","0.002323","150.100.12.7","150.100.0.2","TCP","64","49153  >  57300 [ACK] Seq=101 Ack=101 Win=65535 Len=0 [ETHERNET FRAME CHECK SEQUENCE INCORRECT]"
"124","0.002336","150.100.12.9","150.100.0.2","TCP","64","49153  >  57300 [ACK] Seq=1 Ack=1 Win=65535 Len=0 [ETHERNET FRAME CHECK SEQUENCE INCORRECT]"
"125","0.002351","150.100.12.130","150.100.0.2","TCP","64","49153  >  57300 [ACK] Seq=101 Ack=101 Win=65535 Len=0 [ETHERNET FRAME CHECK SEQUENCE INCORRECT]"
"126","0.002367","150.100.12.131","150.100.0.2","TCP","64","49153  >  57300 [ACK] Seq=101 Ack=101 Win=65535 Len=0 [ETHERNET FRAME CHECK SEQUENCE INCORRECT]"
"127","0.002398","150.100.12.9","150.100.0.2","TCP","158","49153  >  57300 [ACK] Seq=1 Ack=1 Win=65535 Len=100 [ETHERNET FRAME CHECK SEQUENCE INCORRECT]"
"128","0.002449","150.100.0.2","150.100.15.5","TCP","64","57300  >  49153 [ACK] Seq=1 Ack=101 Win=65535 Len=0 [ETHERNET FRAME CHECK SEQUENCE INCORRECT]"
"129","0.002472","150.100.0.2","150.100.15.5","TCP","158","57300  >  49153 [ACK] Seq=1 Ack=101 Win=65535 Len=100 [ETHERNET FRAME CHECK SEQUENCE INCORRECT]"
"130","0.002497","150.100.0.2","150.100.15.5","TCP","158","57300  >  49153 [ACK] Seq=101 Ack=101 Win=65535 Len=100 [ETHERNET FRAME CHECK SEQUENCE INCORRECT]"
"131","0.002517","150.100.0.2","150.100.15.2","TCP","64","57300  >  49153 [ACK] Seq=1 Ack=101 Win=65535 Len=0 [ETHERNET FRAME CHECK SEQUENCE INCORRECT]"
"132","0.002532","150.100.0.2","150.100.15.2","TCP","158","57300  >  49153 [ACK] Seq=1 Ack=101 Win=65535 Len=100 [ETHERNET FRAME CHECK SEQUENCE INCORRECT]"
"133","0.002570","150.100.0.2","150.100.15.2","TCP","158","57300  >  49153 [ACK] Seq=101 Ack=101 Win=65535 Len=100 [ETHERNET FRAME CHECK SEQUENCE INCORRECT]"
"134","0.002591","150.100.0.2","150.100.12.137","TCP","64","57300  >  49153 [ACK] Seq=1 Ack=101 Win=65535 Len=0 [ETHERNET FRAME CHECK SEQUENCE INCORRECT]"
"135","0.002605","150.100.0.2","150.100.12.137","TCP","158","57300  >  49153 [ACK] Seq=1 Ack=101 Win=65535 Len=100 [ETHERNET FRAME CHECK SEQUENCE INCORRECT]"
"136","0.002632","150.100.0.2","150.100.12.137","TCP","158","57300  >  49153 [ACK] Seq=101 Ack=101 Win=65535 Len=100 [ETHERNET FRAME CHECK SEQUENCE INCORRECT]"
"137","0.002656","150.100.0.2","150.100.15.8","TCP","64","57300  >  49153 [ACK] Seq=1 Ack=101 Win=65535 Len=0 [ETHERNET FRAME CHECK SEQUENCE INCORRECT]"
"138","0.002668","150.100.0.2","150.100.15.8","TCP","158","57300  >  49153 [ACK] Seq=1 Ack=101 Win=65535 Len=100 [ETHERNET FRAME CHECK SEQUENCE INCORRECT]"
"139","0.002685","150.100.12.137","150.100.0.2","TCP","64","49153  >  57300 [ACK] Seq=101 Ack=101 Win=65535 Len=0 [ETHERNET FRAME CHECK SEQUENCE INCORRECT]"
"140","0.002710","150.100.0.2","150.100.15.8","TCP","158","57300  >  49153 [ACK] Seq=101 Ack=101 Win=65535 Len=100 [ETHERNET FRAME CHECK SEQUENCE INCORRECT]"
"141","0.002743","150.100.0.2","150.100.12.138","TCP","64","57300  >  49153 [ACK] Seq=1 Ack=101 Win=65535 Len=0 [ETHERNET FRAME CHECK SEQUENCE INCORRECT]"
"142","0.002755","150.100.0.2","150.100.12.138","TCP","158","57300  >  49153 [ACK] Seq=1 Ack=101 Win=65535 Len=100 [ETHERNET FRAME CHECK SEQUENCE INCORRECT]"
"143","0.002776","150.100.0.2","150.100.12.138","TCP","158","57300  >  49153 [ACK] Seq=101 Ack=101 Win=65535 Len=100 [ETHERNET FRAME CHECK SEQUENCE INCORRECT]"
"144","0.002805","150.100.0.2","150.100.12.134","TCP","64","57300  >  49153 [ACK] Seq=1 Ack=101 Win=65535 Len=0 [ETHERNET FRAME CHECK SEQUENCE INCORRECT]"
"145","0.002825","150.100.12.138","150.100.0.2","TCP","64","49153  >  57300 [ACK] Seq=101 Ack=101 Win=65535 Len=0 [ETHERNET FRAME CHECK SEQUENCE INCORRECT]"
"146","0.002837","150.100.0.2","150.100.12.134","TCP","158","57300  >  49153 [ACK] Seq=1 Ack=101 Win=65535 Len=100 [ETHERNET FRAME CHECK SEQUENCE INCORRECT]"
"147","0.002860","150.100.0.2","150.100.12.134","TCP","158","57300  >  49153 [ACK] Seq=101 Ack=101 Win=65535 Len=100 [ETHERNET FRAME CHECK SEQUENCE INCORRECT]"
"148","0.002879","150.100.0.2","150.100.12.8","TCP","64","57300  >  49153 [SYN, ACK] Seq=0 Ack=1 Win=65535 Len=0 [ETHERNET FRAME CHECK SEQUENCE INCORRECT]"
"149","0.002901","150.100.0.2","150.100.12.132","TCP","64","57300  >  49153 [ACK] Seq=1 Ack=101 Win=65535 Len=0 [ETHERNET FRAME CHECK SEQUENCE INCORRECT]"
"150","0.002916","150.100.0.2","150.100.12.132","TCP","158","57300  >  49153 [ACK] Seq=1 Ack=101 Win=65535 Len=100 [ETHERNET FRAME CHECK SEQUENCE INCORRECT]"
"151","0.002937","150.100.0.2","150.100.12.132","TCP","158","57300  >  49153 [ACK] Seq=101 Ack=101 Win=65535 Len=100 [ETHERNET FRAME CHECK SEQUENCE INCORRECT]"
"152","0.002958","150.100.0.2","150.100.15.11","TCP","64","57300  >  49153 [ACK] Seq=1 Ack=101 Win=65535 Len=0 [ETHERNET FRAME CHECK SEQUENCE INCORRECT]"
"153","0.002986","150.100.15.7","150.100.0.2","TCP","64","49153  >  57300 [ACK] Seq=1 Ack=1 Win=65535 Len=0 [ETHERNET FRAME CHECK SEQUENCE INCORRECT]"
"154","0.003017","150.100.15.7","150.100.0.2","TCP","158","49153  >  57300 [ACK] Seq=1 Ack=1 Win=65535 Len=100 [ETHERNET FRAME CHECK SEQUENCE INCORRECT]"
"155","0.003040","150.100.15.3","150.100.0.2","TCP","64","49153  >  57300 [ACK] Seq=1 Ack=1 Win=65535 Len=0 [ETHERNET FRAME CHECK SEQUENCE INCORRECT]"
"156","0.003053","150.100.12.134","150.100.0.2","TCP","64","49153  >  57300 [ACK] Seq=101 Ack=101 Win=65535 Len=0 [ETHERNET FRAME CHECK SEQUENCE INCORRECT]"
"157","0.003074","150.100.15.3","150.100.0.2","TCP","158","49153  >  57300 [ACK] Seq=1 Ack=1 Win=65535 Len=100 [ETHERNET FRAME CHECK SEQUENCE INCORRECT]"
"158","0.003088","150.100.12.8","150.100.0.2","TCP","64","49153  >  57300 [ACK] Seq=1 Ack=1 Win=65535 Len=0 [ETHERNET FRAME CHECK SEQUENCE INCORRECT]"
"159","0.003108","150.100.12.132","150.100.0.2","TCP","64","49153  >  57300 [ACK] Seq=101 Ack=101 Win=65535 Len=0 [ETHERNET FRAME CHECK SEQUENCE INCORRECT]"
"160","0.003128","150.100.12.8","150.100.0.2","TCP","158","49153  >  57300 [ACK] Seq=1 Ack=1 Win=65535 Len=100 [ETHERNET FRAME CHECK SEQUENCE INCORRECT]"
"161","0.003141","150.100.12.11","150.100.0.2","TCP","64","49153  >  57300 [SYN] Seq=0 Win=65535 Len=0 [ETHERNET FRAME CHECK SEQUENCE INCORRECT]"
"162","0.003155","150.100.15.9","150.100.0.2","TCP","64","49153  >  57300 [ACK] Seq=1 Ack=1 Win=65535 Len=0 [ETHERNET FRAME CHECK SEQUENCE INCORRECT]"
"163","0.003177","150.100.15.9","150.100.0.2","TCP","158","49153  >  57300 [ACK] Seq=1 Ack=1 Win=65535 Len=100 [ETHERNET FRAME CHECK SEQUENCE INCORRECT]"
"164","0.003189","150.100.15.10","150.100.0.2","TCP","64","49153  >  57300 [ACK] Seq=1 Ack=1 Win=65535 Len=0 [ETHERNET FRAME CHECK SEQUENCE INCORRECT]"
"165","0.003210","150.100.15.6","150.100.0.2","TCP","64","49153  >  57300 [ACK] Seq=101 Ack=101 Win=65535 Len=0 [ETHERNET FRAME CHECK SEQUENCE INCORRECT]"
"166","0.003243","150.100.15.10","150.100.0.2","TCP","158","49153  >  57300 [ACK] Seq=1 Ack=1 Win=65535 Len=100 [ETHERNET FRAME CHECK SEQUENCE INCORRECT]"
"167","0.003266","150.100.15.4","150.100.0.2","TCP","64","49153  >  57300 [ACK] Seq=101 Ack=101 Win=65535 Len=0 [ETHERNET FRAME CHECK SEQUENCE INCORRECT]"
"168","0.003278","150.100.15.5","150.100.0.2","TCP","64","49153  >  57300 [ACK] Seq=101 Ack=101 Win=65535 Len=0 [ETHERNET FRAME CHECK SEQUENCE INCORRECT]"
"169","0.003296","150.100.15.2","150.100.0.2","TCP","64","49153  >  57300 [ACK] Seq=101 Ack=101 Win=65535 Len=0 [ETHERNET FRAME CHECK SEQUENCE INCORRECT]"
"170","0.003310","150.100.15.8","150.100.0.2","TCP","64","49153  >  57300 [ACK] Seq=101 Ack=101 Win=65535 Len=0 [ETHERNET FRAME CHECK SEQUENCE INCORRECT]"
"171","0.003469","150.100.0.2","150.100.15.11","TCP","158","57300  >  49153 [ACK] Seq=1 Ack=101 Win=65535 Len=100 [ETHERNET FRAME CHECK SEQUENCE INCORRECT]"
"172","0.003488","150.100.0.2","150.100.15.11","TCP","158","57300  >  49153 [ACK] Seq=101 Ack=101 Win=65535 Len=100 [ETHERNET FRAME CHECK SEQUENCE INCORRECT]"
"173","0.003509","150.100.0.2","150.100.12.136","TCP","64","57300  >  49153 [ACK] Seq=1 Ack=101 Win=65535 Len=0 [ETHERNET FRAME CHECK SEQUENCE INCORRECT]"
"174","0.003529","150.100.12.4","150.100.0.2","TCP","64","49153  >  57300 [ACK] Seq=1 Ack=1 Win=65535 Len=0 [ETHERNET FRAME CHECK SEQUENCE INCORRECT]"
"175","0.003550","150.100.12.4","150.100.0.2","TCP","158","49153  >  57300 [ACK] Seq=1 Ack=1 Win=65535 Len=100 [ETHERNET FRAME CHECK SEQUENCE INCORRECT]"
"176","0.003580","150.100.0.2","150.100.12.136","TCP","158","57300  >  49153 [ACK] Seq=1 Ack=101 Win=65535 Len=100 [ETHERNET FRAME CHECK SEQUENCE INCORRECT]"
"177","0.003601","150.100.0.2","150.100.12.136","TCP","158","57300  >  49153 [ACK] Seq=101 Ack=101 Win=65535 Len=100 [ETHERNET FRAME CHECK SEQUENCE INCORRECT]"
"178","0.003630","150.100.0.2","150.100.12.133","TCP","64","57300  >  49153 [ACK] Seq=1 Ack=101 Win=65535 Len=0 [ETHERNET FRAME CHECK SEQUENCE INCORRECT]"
"179","0.003649","150.100.15.11","150.100.0.2","TCP","64","49153  >  57300 [ACK] Seq=101 Ack=101 Win=65535 Len=0 [ETHERNET FRAME CHECK SEQUENCE INCORRECT]"
"180","0.003664","150.100.12.136","150.100.0.2","TCP","64","49153  >  57300 [ACK] Seq=101 Ack=101 Win=65535 Len=0 [ETHERNET FRAME CHECK SEQUENCE INCORRECT]"
"181","0.003676","150.100.0.2","150.100.12.133","TCP","158","57300  >  49153 [ACK] Seq=1 Ack=101 Win=65535 Len=100 [ETHERNET FRAME CHECK SEQUENCE INCORRECT]"
"182","0.003703","150.100.0.2","150.100.12.133","TCP","158","57300  >  49153 [ACK] Seq=101 Ack=101 Win=65535 Len=100 [ETHERNET FRAME CHECK SEQUENCE INCORRECT]"
"183","0.003725","150.100.0.2","150.100.12.139","TCP","64","57300  >  49153 [ACK] Seq=1 Ack=101 Win=65535 Len=0 [ETHERNET FRAME CHECK SEQUENCE INCORRECT]"
"184","0.003740","150.100.0.2","150.100.12.139","TCP","158","57300  >  49153 [ACK] Seq=1 Ack=101 Win=65535 Len=100 [ETHERNET FRAME CHECK SEQUENCE INCORRECT]"
"185","0.003761","150.100.0.2","150.100.12.139","TCP","158","57300  >  49153 [ACK] Seq=101 Ack=101 Win=65535 Len=100 [ETHERNET FRAME CHECK SEQUENCE INCORRECT]"
"186","0.003786","150.100.0.2","150.100.12.6","TCP","64","57300  >  49153 [SYN, ACK] Seq=0 Ack=1 Win=65535 Len=0 [ETHERNET FRAME CHECK SEQUENCE INCORRECT]"
"187","0.003802","150.100.0.2","150.100.12.10","TCP","64","57300  >  49153 [ACK] Seq=1 Ack=101 Win=65535 Len=0 [ETHERNET FRAME CHECK SEQUENCE INCORRECT]"
"188","0.003815","150.100.0.2","150.100.12.10","TCP","158","57300  >  49153 [ACK] Seq=1 Ack=101 Win=65535 Len=100 [ETHERNET FRAME CHECK SEQUENCE INCORRECT]"
"189","0.003838","150.100.0.2","150.100.12.10","TCP","158","57300  >  49153 [ACK] Seq=101 Ack=101 Win=65535 Len=100 [ETHERNET FRAME CHECK SEQUENCE INCORRECT]"
"190","0.003860","150.100.0.2","150.100.12.135","TCP","64","57300  >  49153 [ACK] Seq=1 Ack=101 Win=65535 Len=0 [ETHERNET FRAME CHECK SEQUENCE INCORRECT]"
"191","0.003872","150.100.0.2","150.100.12.135","TCP","158","57300  >  49153 [ACK] Seq=1 Ack=101 Win=65535 Len=100 [ETHERNET FRAME CHECK SEQUENCE INCORRECT]"
"192","0.003895","150.100.0.2","150.100.12.135","TCP","158","57300  >  49153 [ACK] Seq=101 Ack=101 Win=65535 Len=100 [ETHERNET FRAME CHECK SEQUENCE INCORRECT]"
"193","0.003922","150.100.0.2","150.100.12.12","TCP","64","57300  >  49153 [SYN, ACK] Seq=0 Ack=1 Win=65535 Len=0 [ETHERNET FRAME CHECK SEQUENCE INCORRECT]"
"194","0.003934","150.100.0.2","150.100.12.9","TCP","64","57300  >  49153 [ACK] Seq=1 Ack=101 Win=65535 Len=0 [ETHERNET FRAME CHECK SEQUENCE INCORRECT]"
"195","0.003948","150.100.0.2","150.100.12.9","TCP","158","57300  >  49153 [ACK] Seq=1 Ack=101 Win=65535 Len=100 [ETHERNET FRAME CHECK SEQUENCE INCORRECT]"
"196","0.003974","150.100.0.2","150.100.12.9","TCP","158","57300  >  49153 [ACK] Seq=101 Ack=101 Win=65535 Len=100 [ETHERNET FRAME CHECK SEQUENCE INCORRECT]"
"197","0.003996","150.100.0.2","150.100.15.7","TCP","64","57300  >  49153 [ACK] Seq=1 Ack=101 Win=65535 Len=0 [ETHERNET FRAME CHECK SEQUENCE INCORRECT]"
"198","0.004009","150.100.0.2","150.100.15.7","TCP","158","57300  >  49153 [ACK] Seq=1 Ack=101 Win=65535 Len=100 [ETHERNET FRAME CHECK SEQUENCE INCORRECT]"
"199","0.004028","150.100.0.2","150.100.15.7","TCP","158","57300  >  49153 [ACK] Seq=101 Ack=101 Win=65535 Len=100 [ETHERNET FRAME CHECK SEQUENCE INCORRECT]"
"200","0.004048","150.100.12.133","150.100.0.2","TCP","64","49153  >  57300 [ACK] Seq=101 Ack=101 Win=65535 Len=0 [ETHERNET FRAME CHECK SEQUENCE INCORRECT]"
"201","0.004062","150.100.12.139","150.100.0.2","TCP","64","49153  >  57300 [ACK] Seq=101 Ack=101 Win=65535 Len=0 [ETHERNET FRAME CHECK SEQUENCE INCORRECT]"
"202","0.004084","150.100.12.6","150.100.0.2","TCP","64","49153  >  57300 [ACK] Seq=1 Ack=1 Win=65535 Len=0 [ETHERNET FRAME CHECK SEQUENCE INCORRECT]"
"203","0.004107","150.100.12.6","150.100.0.2","TCP","158","49153  >  57300 [ACK] Seq=1 Ack=1 Win=65535 Len=100 [ETHERNET FRAME CHECK SEQUENCE INCORRECT]"
"204","0.004123","150.100.12.135","150.100.0.2","TCP","64","49153  >  57300 [ACK] Seq=101 Ack=101 Win=65535 Len=0 [ETHERNET FRAME CHECK SEQUENCE INCORRECT]"
"205","0.004137","150.100.12.10","150.100.0.2","TCP","64","49153  >  57300 [ACK] Seq=101 Ack=101 Win=65535 Len=0 [ETHERNET FRAME CHECK SEQUENCE INCORRECT]"
"206","0.004149","150.100.12.9","150.100.0.2","TCP","64","49153  >  57300 [ACK] Seq=101 Ack=101 Win=65535 Len=0 [ETHERNET FRAME CHECK SEQUENCE INCORRECT]"
"207","0.004168","150.100.12.12","150.100.0.2","TCP","64","49153  >  57300 [ACK] Seq=1 Ack=1 Win=65535 Len=0 [ETHERNET FRAME CHECK SEQUENCE INCORRECT]"
"208","0.004185","150.100.15.7","150.100.0.2","TCP","64","49153  >  57300 [ACK] Seq=101 Ack=101 Win=65535 Len=0 [ETHERNET FRAME CHECK SEQUENCE INCORRECT]"
"209","0.004357","150.100.12.12","150.100.0.2","TCP","158","49153  >  57300 [ACK] Seq=1 Ack=1 Win=65535 Len=100 [ETHERNET FRAME CHECK SEQUENCE INCORRECT]"
"210","0.004412","150.100.0.2","150.100.15.3","TCP","64","57300  >  49153 [ACK] Seq=1 Ack=101 Win=65535 Len=0 [ETHERNET FRAME CHECK SEQUENCE INCORRECT]"
"211","0.004425","150.100.0.2","150.100.15.3","TCP","158","57300  >  49153 [ACK] Seq=1 Ack=101 Win=65535 Len=100 [ETHERNET FRAME CHECK SEQUENCE INCORRECT]"
"212","0.004446","150.100.0.2","150.100.15.3","TCP","158","57300  >  49153 [ACK] Seq=101 Ack=101 Win=65535 Len=100 [ETHERNET FRAME CHECK SEQUENCE INCORRECT]"
"213","0.004468","150.100.0.2","150.100.12.8","TCP","64","57300  >  49153 [ACK] Seq=1 Ack=101 Win=65535 Len=0 [ETHERNET FRAME CHECK SEQUENCE INCORRECT]"
"214","0.004485","150.100.0.2","150.100.12.8","TCP","158","57300  >  49153 [ACK] Seq=1 Ack=101 Win=65535 Len=100 [ETHERNET FRAME CHECK SEQUENCE INCORRECT]"
"215","0.004508","150.100.0.2","150.100.12.8","TCP","158","57300  >  49153 [ACK] Seq=101 Ack=101 Win=65535 Len=100 [ETHERNET FRAME CHECK SEQUENCE INCORRECT]"
"216","0.004529","150.100.0.2","150.100.12.11","TCP","64","57300  >  49153 [SYN, ACK] Seq=0 Ack=1 Win=65535 Len=0 [ETHERNET FRAME CHECK SEQUENCE INCORRECT]"
"217","0.004550","150.100.15.3","150.100.0.2","TCP","64","49153  >  57300 [ACK] Seq=101 Ack=101 Win=65535 Len=0 [ETHERNET FRAME CHECK SEQUENCE INCORRECT]"
"218","0.004566","150.100.12.8","150.100.0.2","TCP","64","49153  >  57300 [ACK] Seq=101 Ack=101 Win=65535 Len=0 [ETHERNET FRAME CHECK SEQUENCE INCORRECT]"
"219","0.004590","150.100.0.2","150.100.15.9","TCP","64","57300  >  49153 [ACK] Seq=1 Ack=101 Win=65535 Len=0 [ETHERNET FRAME CHECK SEQUENCE INCORRECT]"
"220","0.004614","150.100.0.2","150.100.15.9","TCP","158","57300  >  49153 [ACK] Seq=1 Ack=101 Win=65535 Len=100 [ETHERNET FRAME CHECK SEQUENCE INCORRECT]"
"221","0.004635","150.100.0.2","150.100.15.9","TCP","158","57300  >  49153 [ACK] Seq=101 Ack=101 Win=65535 Len=100 [ETHERNET FRAME CHECK SEQUENCE INCORRECT]"
"222","0.004657","150.100.0.2","150.100.15.10","TCP","64","57300  >  49153 [ACK] Seq=1 Ack=101 Win=65535 Len=0 [ETHERNET FRAME CHECK SEQUENCE INCORRECT]"
"223","0.004674","150.100.12.11","150.100.0.2","TCP","64","49153  >  57300 [ACK] Seq=1 Ack=1 Win=65535 Len=0 [ETHERNET FRAME CHECK SEQUENCE INCORRECT]"
"224","0.004695","150.100.12.11","150.100.0.2","TCP","158","49153  >  57300 [ACK] Seq=1 Ack=1 Win=65535 Len=100 [ETHERNET FRAME CHECK SEQUENCE INCORRECT]"
"225","0.004705","150.100.0.2","150.100.15.10","TCP","158","57300  >  49153 [ACK] Seq=1 Ack=101 Win=65535 Len=100 [ETHERNET FRAME CHECK SEQUENCE INCORRECT]"
"226","0.004731","150.100.0.2","150.100.15.10","TCP","158","57300  >  49153 [ACK] Seq=101 Ack=101 Win=65535 Len=100 [ETHERNET FRAME CHECK SEQUENCE INCORRECT]"
"227","0.004754","150.100.0.2","150.100.12.4","TCP","64","57300  >  49153 [ACK] Seq=1 Ack=101 Win=65535 Len=0 [ETHERNET FRAME CHECK SEQUENCE INCORRECT]"
"228","0.004766","150.100.0.2","150.100.12.4","TCP","158","57300  >  49153 [ACK] Seq=1 Ack=101 Win=65535 Len=100 [ETHERNET FRAME CHECK SEQUENCE INCORRECT]"
"229","0.004787","150.100.0.2","150.100.12.4","TCP","158","57300  >  49153 [ACK] Seq=101 Ack=101 Win=65535 Len=100 [ETHERNET FRAME CHECK SEQUENCE INCORRECT]"
"230","0.004805","150.100.15.9","150.100.0.2","TCP","64","49153  >  57300 [ACK] Seq=101 Ack=101 Win=65535 Len=0 [ETHERNET FRAME CHECK SEQUENCE INCORRECT]"
"231","0.004820","150.100.0.2","150.100.12.6","TCP","64","57300  >  49153 [ACK] Seq=1 Ack=101 Win=65535 Len=0 [ETHERNET FRAME CHECK SEQUENCE INCORRECT]"
"232","0.004833","150.100.0.2","150.100.12.6","TCP","158","57300  >  49153 [ACK] Seq=1 Ack=101 Win=65535 Len=100 [ETHERNET FRAME CHECK SEQUENCE INCORRECT]"
"233","0.004855","150.100.15.10","150.100.0.2","TCP","64","49153  >  57300 [ACK] Seq=101 Ack=101 Win=65535 Len=0 [ETHERNET FRAME CHECK SEQUENCE INCORRECT]"
"234","0.004882","150.100.0.2","150.100.12.6","TCP","158","57300  >  49153 [ACK] Seq=101 Ack=101 Win=65535 Len=100 [ETHERNET FRAME CHECK SEQUENCE INCORRECT]"
"235","0.004901","150.100.12.4","150.100.0.2","TCP","64","49153  >  57300 [ACK] Seq=101 Ack=101 Win=65535 Len=0 [ETHERNET FRAME CHECK SEQUENCE INCORRECT]"
"236","0.004924","150.100.0.2","150.100.12.12","TCP","64","57300  >  49153 [ACK] Seq=1 Ack=101 Win=65535 Len=0 [ETHERNET FRAME CHECK SEQUENCE INCORRECT]"
"237","0.004937","150.100.0.2","150.100.12.12","TCP","158","57300  >  49153 [ACK] Seq=1 Ack=101 Win=65535 Len=100 [ETHERNET FRAME CHECK SEQUENCE INCORRECT]"
"238","0.004957","150.100.0.2","150.100.12.12","TCP","158","57300  >  49153 [ACK] Seq=101 Ack=101 Win=65535 Len=100 [ETHERNET FRAME CHECK SEQUENCE INCORRECT]"
"239","0.004976","150.100.12.6","150.100.0.2","TCP","64","49153  >  57300 [ACK] Seq=101 Ack=101 Win=65535 Len=0 [ETHERNET FRAME CHECK SEQUENCE INCORRECT]"
"240","0.004990","150.100.0.2","150.100.12.11","TCP","64","57300  >  49153 [ACK] Seq=1 Ack=101 Win=65535 Len=0 [ETHERNET FRAME CHECK SEQUENCE INCORRECT]"
"241","0.005003","150.100.0.2","150.100.12.11","TCP","158","57300  >  49153 [ACK] Seq=1 Ack=101 Win=65535 Len=100 [ETHERNET FRAME CHECK SEQUENCE INCORRECT]"
"242","0.005023","150.100.0.2","150.100.12.11","TCP","158","57300  >  49153 [ACK] Seq=101 Ack=101 Win=65535 Len=100 [ETHERNET FRAME CHECK SEQUENCE INCORRECT]"
"243","0.005109","150.100.12.12","150.100.0.2","TCP","64","49153  >  57300 [ACK] Seq=101 Ack=101 Win=65535 Len=0 [ETHERNET FRAME CHECK SEQUENCE INCORRECT]"
"244","0.005123","150.100.12.11","150.100.0.2","TCP","64","49153  >  57300 [ACK] Seq=101 Ack=101 Win=65535 Len=0 [ETHERNET FRAME CHECK SEQUENCE INCORRECT]"
"245","0.008871","150.100.15.7","150.100.0.2","TCP","158","49153  >  57300 [ACK] Seq=101 Ack=201 Win=65535 Len=100 [ETHERNET FRAME CHECK SEQUENCE INCORRECT]"
"246","0.008871","150.100.0.2","150.100.15.7","TCP","158","57300  >  49153 [ACK] Seq=201 Ack=201 Win=65535 Len=100 [ETHERNET FRAME CHECK SEQUENCE INCORRECT]"
"247","0.008885","150.100.0.2","150.100.15.7","TCP","158","57300  >  49153 [ACK] Seq=301 Ack=201 Win=65535 Len=100 [ETHERNET FRAME CHECK SEQUENCE INCORRECT]"
"248","0.008964","150.100.15.7","150.100.0.2","TCP","64","49153  >  57300 [ACK] Seq=201 Ack=301 Win=65535 Len=0 [ETHERNET FRAME CHECK SEQUENCE INCORRECT]"
"249","0.009621","150.100.12.9","150.100.0.2","TCP","158","49153  >  57300 [ACK] Seq=101 Ack=201 Win=65535 Len=100 [ETHERNET FRAME CHECK SEQUENCE INCORRECT]"
"250","0.009621","150.100.0.2","150.100.12.9","TCP","158","57300  >  49153 [ACK] Seq=201 Ack=201 Win=65535 Len=100 [ETHERNET FRAME CHECK SEQUENCE INCORRECT]"
"251","0.009634","150.100.0.2","150.100.12.9","TCP","158","57300  >  49153 [ACK] Seq=301 Ack=201 Win=65535 Len=100 [ETHERNET FRAME CHECK SEQUENCE INCORRECT]"
"252","0.009682","150.100.12.9","150.100.0.2","TCP","64","49153  >  57300 [ACK] Seq=201 Ack=301 Win=65535 Len=0 [ETHERNET FRAME CHECK SEQUENCE INCORRECT]"
"253","0.013676","150.100.12.11","150.100.0.2","TCP","158","49153  >  57300 [ACK] Seq=101 Ack=201 Win=65535 Len=100 [ETHERNET FRAME CHECK SEQUENCE INCORRECT]"
"254","0.013676","150.100.0.2","150.100.12.11","TCP","158","57300  >  49153 [ACK] Seq=201 Ack=201 Win=65535 Len=100 [ETHERNET FRAME CHECK SEQUENCE INCORRECT]"
"255","0.013690","150.100.0.2","150.100.12.11","TCP","158","57300  >  49153 [ACK] Seq=301 Ack=201 Win=65535 Len=100 [ETHERNET FRAME CHECK SEQUENCE INCORRECT]"
"256","0.013738","150.100.12.11","150.100.0.2","TCP","64","49153  >  57300 [ACK] Seq=201 Ack=301 Win=65535 Len=0 [ETHERNET FRAME CHECK SEQUENCE INCORRECT]"
"257","0.038188","150.100.12.10","150.100.0.2","TCP","158","49153  >  57300 [ACK] Seq=101 Ack=201 Win=65535 Len=100 [ETHERNET FRAME CHECK SEQUENCE INCORRECT]"
"258","0.038188","150.100.0.2","150.100.12.10","TCP","158","57300  >  49153 [ACK] Seq=201 Ack=201 Win=65535 Len=100 [ETHERNET FRAME CHECK SEQUENCE INCORRECT]"
"259","0.038201","150.100.0.2","150.100.12.10","TCP","158","57300  >  49153 [ACK] Seq=301 Ack=201 Win=65535 Len=100 [ETHERNET FRAME CHECK SEQUENCE INCORRECT]"
